Variable_Label,Data_Type,Description,Source,Sheets
Investigation Closing to Recall,Integer,"Subtracting Date Investigation Closed from the Recall Date measures the number of days the process took between the NHTSA closing the investigation and the manufacturer legally initiating the recall. The variable has negative values for cases where the manufacturer initiated a recall before NHTSA closing an investigation, and does not have a value if the investigation did not result in a recall, Example: for recall 09V055000, Investigation Closing to Recall is -15 days, which is the number of days elapsed between March 4, 2009 when the NHTSA closed the investigation, and February 17, 2009 when Blue Bird Body Company notified the NHTSA of its recall.",Closing resume and NHTSA recalls data,Outcomes of Inv
Owner Notification Date,MM/DD/YYYY,"The date when the manufacturer notified the affected vehicle owners. The variable does not have a value if the investigation did not result in a recall, For example, Blue Bird Body Company notified the affected owners of its recall 09V055000 on April 2, 2009.",NHTSA recalls data,Outcomes of Inv
Recall to Owner Notification,Integer,"Subtracting Recall Date from the Owner Notification Date measures the number of days the process took between the manufacturer legally initiating the recall and the manufacturer notifying the owners of the affected vehicles. The variable has negative values for cases where the manufacturer notified the owners before legally initiating the recall, and does not have a value if the investigation did not result in a recall, Example: for recall 09V055000, Recall to Owner Notification is 44 days, which is the number of days elapsed between February 17, 2009 when Blue Bird Body Company notified the NHTSA of its recall, and April 2, 2009, when Blue Bird Body Company notified the owners of the vehicles. ",Closing resume and NHTSA recalls data,Outcomes of Inv
Recall Size,Long integer,"The number of vehicles recalled. The variable does not have a value if the investigation did not result in a recall, For example, recall ID 09V055000 affected 4,591 vehicles.",NHTSA recalls data,Outcomes of Inv
Recall Scope,Long integer,"The number of make-year, make, model combinations affected by the recall. The variable does not have a value if the investigation did not result in a recall, For example, recall 09V055000 affected two combinations of model year, make, and model: 2007 Blue Bird Vision and 2008 Blue Bird Vision school buses, so its Recall Scope is equal to 2. ",NHTSA recalls data,Outcomes of Inv
Make Model Years,Long string,"The set of distinct make, model, and make-year combinations affected by the recall. The variable does not have a value if the investigation did not result in a recall, Example: recall 09V055000 MakeModelYears has the value of “blue bird vision 2007, blue bird vision 2008”. ",NHTSA recalls data,Outcomes of Inv
Manufacturer,String of 40 characters,"The name of the manufacturer that filed the defect or noncompliance report. The variable does not have a value if the investigation did not result in a recall, Example: recall 09V055000 Manufacturer is “blue bird body company”",NHTSA recalls data,Outcomes of Inv
No. Distinct Manufacturers of Recalled Products,Integer,The number of distinct manufacturers that initiated recalls as part of the unique recall campaign ID.,NHTSA recalls data,Outcomes of Inv
Manufacturers of Recalled Products,String of 78 characters,"Name of all the distinct manufacturers of the components or products recalled as part of the unique recall campaign ID. The variable does not have a value if the investigation did not result in a recall, Example: recall 10V436000 Manufacturers takes the value of “honda (american honda motor co.), isuzu motors limited”. ",NHTSA recalls data,Outcomes of Inv
Recall Type,String of 1 character,"Recall type, taking values of V for vehicle, E for equipment, T for tire report, and C for component. The variable does not have a value if the investigation did not result in a recall.",NHTSA recalls data,Outcomes of Inv
Influenced By,String of 4 characters,"The recall initiator, taking values of MFR for manufacturer, OVSC for the Office of Vehicle Safety Compliance, and ODI for the Office of Defect Investigations. The variable does not have a value if the investigation did not result in a recall.",NHTSA recalls data,Outcomes of Inv
Defect Description,String of 1982 characters,"Defect or noncompliance summary. The variable does not have a value if the investigation did not result in a recall, Example: recall 12V006000 Defect Description is as follows: “ford is recalling certain model year 2004 and 2005 ford freestar and mercury monterey vehicles.  the torque converter output shaft may fail.” ",NHTSA recalls data,Outcomes of Inv
Defect Consequence,String of 759 characters,"Summary of the consequence of product defect or noncompliance. The variable does not have a value if the investigation did not result in a recall, Example: recall 12V006000 Defect Consequence is as follows: “this condition results in a sudden loss of motive power with no warning, increasing the risk of a crash.”",NHTSA recalls data,Outcomes of Inv
Corrective Action,String of 1678 characters,"Summary of the corrective action taken by the manufacturer. The variable does not have a value if the investigation did not result in a recall, Example: recall 10V436000 Corrective Action is: “Ford will notify owners, and dealers will replace the torque converter free of charge.  the safety recall began on august 9, 2012. Owners may contact the Ford Motor Company customer relationship center at 1-866-436-7332.”",NHTSA recalls data,Outcomes of Inv
No. Product Damage Reports Up to Quarter of Recall,Integer,"The total number of injury or death reports for the make-model-year, based on the manufacturers’ early warning reports, up to the quarter of the year that the recall was initiated. ",NHTSA recalls and early warnings data,Outcomes of Inv
No. Deaths Reports Up to Quarter of Recall,Integer,"The total number of injuries reported for the make-model-year, based on the manufacturers’ early warning reports, up to the quarter of the year that the recall was initiated.",NHTSA recalls and early warnings data,Outcomes of Inv
No. Injuries Reports Up to Quarter of Recall,Integer,"The total number of injuries reported for the make-model-year, based on the manufacturers’ early warning reports, up to the quarter of the year that the recall was initiated.",NHTSA recalls and early warnings data,Outcomes of Inv
No. Injury and Death Reports Up to Quarter of Recall,Integer,"The total number of product damage reports for the make-model-year based on the manufacturers’ early warning reports, up to the quarter of the year that the recall was initiated.",NHTSA recalls and early warnings data,Outcomes of Inv
Manufacturer Awareness Date ,MM/DD/YYYY,The date when the manufacturer first became aware of the defect or noncompliance. ,Astvansh et al. (2022),Outcomes of Inv
Manufacturer Awareness to Recall,Integer,The number of days between the Manufacturer Awareness Date and Recall Date.,Astvansh et al. (2022),Outcomes of Inv
Supplier Mentioned,String of 3 characters,Does the Chronology mention a supplier? Yes or no. ,Astvansh et al. (2022),Outcomes of Inv
