Firm,Product/service,Letter,NAICS2,Industry,Date,JustificationType (LLM Label),JustificationType (Authors' Label),Subscription,Concreteness,Length
Duke Energy Carolinas,Residential Electricity Utility Service,"Rate changes start Jan. 15. After extensive evaluation since the rate review was requested last January, along with constructive settlements with the NCUC Public Staff and other parties, the NCUC approved a net increase in retail revenues in year one of about $436 million (8.3%), followed by $173 million (3.3%) in year two and $165 million (3.1%) in year three. Customer bills already reflect an interim rate adjustment implemented Sept. 1. Accounting for that, beginning Jan. 15, the change from current rates for a typical residential customer using 1,000 kilowatt-hours (kWh) per month will be an increase of $10.04, from $130.29 to $140.33 per month, followed by a $4.19 increase on Jan. 1, 2025, and a $4.10 increase on Jan. 1, 2026, for a total of $148.62 by 2026. According to the Edison Electric Institute, the national monthly average for typical residential customers was $171.67 as of Jan. 1, 2023, before other utilities go through their own rate adjustments.",22 - Utilities,221122 – Electric Power Distribution,15-Jan-24,Market,Cost,Yes,328.47330196969693,159
Mt. Konocti Mutual Water Co.,Residential Water Utility Service,"Due to the rising costs of PG&E, fuel and other utilities, we will be increasing rates again this year.  The increase will be $8.45 per month residential base rate and the tiers will also increase",22 - Utilities,221310 – Water Supply and Irrigation Systems,31-May-24,Cost,Cost,Yes,322.28011000000004,35
PG&E,Residential Electricity and Natural Gas Utility Service (PG&E via Direct Access or CCA),"As part of our commitment to transparency, we also want you to know that the state regulatory process for determining January 2024 rates is complete and we want you to have more details on how this change in rates will impact you. The chart below provides a range for how your bill may change starting in January 2024. These estimates include the lower natural gas commodity prices this winter compared to last winter. On average, residential rates for services provided by PG&E to Direct Access and Community Choice Aggregation customers would increase by 24% compared to current rates. Check with your provider to learn how this would impact your overall bill.",22 - Utilities,221122 – Electric Power Distribution,1-Jan-24,Cost,Cost,Yes,324.29110990654203,111
Austin Energy,Plug-In EVerywhereSM Level 2 EV Charging,"We are writing to inform you of an upcoming change in the Plug-In EVerywhereSM Level 2 subscription pilot program effective June 30th. On that date, the subscription renewal period will end. You will not receive any further charges for subscription renewal. You will not have to call or submit a cancellation request form because we are actively working on canceling all subscribers by June 30, 2024. Starting June 30, 2024, the new pricing plan will be as follows:Level 2 Charging Stations will charge $0.09 per kWh, which comes out to ""about"" a penny_per minute_(previously $25 six- month subscription). DC Fast Charging will remain accessible to all at $0.21 per minute. You will still have access to the Plug-In Austin charging network through your ChargePoint RFID card or the mobile app until June 30, 2024. Direct billing through Austin Energy will not be necessary as we are actively working on canceling all subscribers by the end of June. No further action is required. Why are we making this change? When the pilot subscription plan started in 2011, there were fewer than one hundred EVs in Austin, and just over one hundred Austin Energy Level 2 Charging Stations. The cost of using an Austin Energy EV charger was set at a $25 six-month subscription. Today, there are more than 42,000 EVs in Austin. Austin Energy has over 1,600 Level 2 Charging Stations and 30 DC Fast Charging Stations. Updating the pricing plan will allow Austin Energy to continue to support lower costs overall. We value and appreciate you during this transition. Our commitment to affordability, accessibility, and environmental responsibility remains steadfast.",22 – Utilities,221118 – Other Electric Power Generation,30-Jun-24,Quality,Quality,Yes,329.81642979079504,269
SoCalGas ,Residential natural gas service,"Dear Customer, There's no easy way to put this: January bills are likely to be higher than usual. An unprecedented cold snap across the nation in part has caused natural gas market prices in the West to more than double between December and January‚ much higher than expected. As a result, SoCalGas residential customers can expect the typical January bill likely to be more than double the typical bill last January, assuming the same amount of natural gas is used.",22 – Utilities,221210 – Natural Gas Distribution,1-Jan-23,Market,Cost,Yes,328.121026875,80
Kyani,Nutritional Supplements and Wellness Products,"The ongoing pandemic continues to create challenges throughout the world economy, and we have experienced rising costs across our supply chain, including raw material and shipping. Given this situation, we are obliged to inform you that we are increasing the product prices effective from 2nd July 2022 while details will be posted on the Backoffice.For any enquiries, please contact Ky√§ni Hong Kong Customer Service Hotline at (852) 2670 1171 or email to cs.hk@kyanicorp.com or visit www.kyani.com.",31 - Manufacturing,325412 – Pharmaceutical Preparation Manufacturing,2-Jul-22,Cost,Cost,Yes,334.680591969697,76
Nespresso,Nespresso Coffee Pods (including AutoReplenish Subscriptions),"Dear Valued Customer,We are writing to inform you that as of January 8th, 2025, you will see an increase in Nespresso coffee prices.We've seen a historic impact on the coffee sector, with coffee prices recently reaching a 10-year-high combined with rising shipping and transportation costs. As a result, we have had to slightly increase our coffee prices to continue to offer you the high-quality, sustainably sourced coffees you deserve and expect every day.Nespresso's AutoReplenish service will reflect the new prices automatically. ",31 - Manufacturing, 311920 – Coffee and Tea Manufacturing,8-Jan-25,Cost,Cost,Yes,347.971483625,81
Nespresso,Nespresso Coffee Capsules (Vertuo & Original lines),"As you may know, the price of green coffee, the raw beans used to make your coffee, has surged to record highs. Changes in temperature and rainfall patterns are affecting the suitability of regions to grow coffee and pose a significant threat to both coffee cultivation and the future of coffee farmers, putting many coffee-growing areas under pressure. Our goal is to continue supporting and empowering coffee farmers worldwide through the Nespresso AAA Sustainable Quality Program, as it is our priority to maintain the highest quality coffee, with the best aroma profile criteria. To fulfill this promise, we depend on a reliable long-term supply of high-quality beans to deliver the unforgettable taste Nespresso is known for. Although we have chosen to absorb the majority of the price impact, an adjustment to our coffee capsule prices remains necessary and will take effect on February 5th, 2025. The price of our Vertuo coffees will increase between $0.03 and $0.15 per capsule depending on formats and ranges (except Master Origins coffees in coffee format, which go up to $0.18 per capsule). On the Original line, the price of our World Explorations range will increase by $0.05 per capsule. ",31 - Manufacturing,311920 – Coffee and Tea Manufacturing,5-Feb-25,Cost,"Cost, quality",Yes,343.11370048648644,195
Garmin,Annual Program Fee (Garmin Subscription),"We are writing to inform you that, effective Jan. 4, 2021, the price of your Annual Program Fee will increase from $24.95 to $34.95. The Annual Program Fee is charged yearly upon the anniversary of your subscription activation date. ",33 – Manufacturing,334220 – Radio and Television Broadcasting and Wireless Communications Equipment Manufacturing,4-Jan-21,No-justification,No-justification,Yes,333.733606,39
Bespoke Post,Monthly Lifestyle Subscription Box (Bespoke Post),"We have an update about your membership so we'll get right to it: Starting in March 2022, the price of a box for Members (that's you) will go from $45 to $49 (Non-Members will go from $55 to $70) and shipping will increase to $4.95 (but orders over $95 ship for free). We packed up and shipped out our first box back in November of 2011. For over 10 years we're proud that we've kept our box price constant at $45, but the cost of doing business has changed in a way we've never seen before. Everyone from our small brand partners to our warehouse and shipping partners have needed to increase prices due to higher costs for materials, labor, shipping, and more. To be able to support our partners and maintain the promise of each of our boxes, we unfortunately have to raise the price.",44 - Retail Trade,454110 – Electronic Shopping and Mail-Order Houses,1-Mar-22,Cost,Cost,Yes,321.6306464748202,146
Birchbox,Monthly Beauty Subscription Box (Birchbox),"New to this month as well, we will be updating the price of membership by $5 per month going forward - your monthly membership cost is now $20. The new pricing ensures Birchbox can continue its successful path forward, offsetting the increase in transportation and labor costs, while continuing to curate an elevated selection of beauty products each month.",44 - Retail Trade,454110 – Electronic Shopping and Mail-Order Houses,1-Aug-23,Cost,"Cost, quality",Yes,327.87987722222215,59
Ellie,Activewear Subscription Box (Ellie),"Beginning September 1st, due to increased shipping and production costs, Ellie prices will increase for NEW subscriptions, and 2- and 5-item boxes will no longer be an option for new subscribers. However, any existing subscriptions before September will continue to enjoy the current rate and our 2- and 5-item boxes. We're encouraging our new customers to LOCK IN the lower price and additional options by subscribing before the changes hit - so hurry, sign up now before it's too late!",44 - Retail Trade,454110 – Electronic Shopping and Mail-Order Houses,18-Aug-22,Cost,Cost,Yes,326.57305358974367,80
Cocotique,Cocotique Beauty Subscription,"We would like to thank you for your loyalty and support over the past 4 years, Some of you have been subscribers since our launch in 2013. Regardless of how long you've been a part of the COCOTIQUE family, we truly appreciate you! We have been committed to bringing you each month the best in beauty for women of color. You asked for more full-size products and as you've seen over the past year, we've increased the amount of products in your boxes as well as added more full size products. We hope that you've enjoyed the past few months of Mega Beauty Boxes with up to 11 different products.",44 – Retail Trade,"446120 – Cosmetics, Beauty Supplies, and Perfume Stores",1-Nov-17,Quality,Quality,Yes,311.28593037735845,110
Costco,Annual membership (Standard and Executive tiers),"Effective September 1, 2024, membership fees have increased. All Costco memberships will continue to include one free card for a designated member of the household who is 16 years of age or over. Our membership fees help to offset operational costs so we can keep our prices low. A modest increase in fees will allow us to bring our members even greater value. To learn more about why we charge a membership fee, click here. New Sign-ups: New members will be charged the new fee structure effective Sept.1, 2024. Renewals: The fee increase took place beginning with September 2024 renewals, which members began receiving in mid-July. Auto Renew"" Memberships that are auto renewed will be charged the new fee effective Sept. 1, 2024. Upgrades: All Executive upgrades will be based on the new fee structure effective Sept. 1, 2024. ExecutiveEffective Sept. 1, we also increased the cap on the Executive Membership 2% Reward from $1,000 per year to $1,250 per year.",44 – Retail Trade,452311 – Warehouse Clubs and Supercenters,1-Sep-24,"Cost, quality","Cost, quality",Yes,334.60830198630134,161
Ipsy,Glam Bag Plus,"At IPSY, we're always looking for new ways to enhance your membership and help you discover more beauty products you'll love.To ensure your experience keeps getting better, we're changing the price of Glam Bag Plus to $28 a month starting with October shipments. We're excited to keep bringing you amazing brands-like GOLDFADEN MD, KATE SOMERVILLE, and UOMA BEAUTY-trending products, and more personalization than ever before. Don't worry, your Glam Bag X price remains the same.",44 – Retail Trade,"446120 – Cosmetics, Beauty Supplies, and Perfume Stores",1-Aug-21,Quality,Quality,Yes,331.04819081081087,75
Sam's Club,Sam's Club Membership,"Starting October 17, 2022, membership fees will increase from $45 to $50 for Club members and from $100 to $110 for Plus members. The fee for add-on memberships will increase from $40 to $45. The price adjustment will impact new members upon their annual renewal date. If their renewal date is on or after October 17, 2022, that's when they will see the adjustment go into effect. Renewals before October 17, 2022 will be at the current fee ($45 for Club membership/$100 for Plus membership). Starting on October 17, 2022, it will update to the new fee ($50 for Club membership/$110 for Plus membership). When a member renews, they will automatically earn the $5 or $10 Sam's Cash offset and it will be automatically applied to their Sam's Cash account within 24 hours. They do not have to take any additional steps to earn the Sam's Cash.",44 – Retail Trade,442299 – All Other General Merchandise Stores,17-Oct-22,No-justification,No-justification,Yes,320.2140187878788,147
YumeTwins,Yume Twins Monthly Box,"We've been working on a variety of improvements, such as including bigger, better items and increasing the items from 5 to 6~ 8 items per box!To keep bringing you the best value and quality goods, the price for our monthly box has changed to $35. Your billing will automatically reflect the new price starting in 2018.If you have a forever coupon, worry not as it will still be applied to your account!If you have any questions, please reply to this email. Thanks for being a part of the Yume Twins family!",44 – Retail Trade,424990 – Other Miscellaneous Nondurable Goods Merchant Wholesalers,1-Jan-18,Quality,Quality,Yes,323.6092548275862,91
Allure,Allure Beauty Box (monthly beauty subscription),"We're committed to introducing you to your new favorite beauty products at an incredible value every month, and providing our loyal community with an amazing Allure Beauty Box experience.We have encountered industry-wide rising global product and shipping costs, and we've worked hard to manage them. We'll never compromise on quality-and to continue bringing you everything you expect and more, we need to increase the price of subscriptions billed monthly by $2 to $25 beginning on April 1, 2023. But here's the good news-if you change your current billing plan, you'll spend less than the current monthly box price and you'll get a $10 bonus to spend in the Member Store (we'll send you an email, so keep an eye on your inbox)!",45 – Retail Trade,454110 – Electronic Shopping and Mail-Order Houses,1-Apr-23,"Cost, quality","Cost, quality",Yes,331.31889879032263,122
Amazon,Amazon Prime Membership (annual subscription),"We are writing to provide you advance notice that the price of your Prime membership will be increasing. The annual rate will be $99 when your membership renews on June 20, 2014. Even as fuel and transportation costs have increased, the price of Prime has remained the same for nine years. Since 2005, the number of items eligible for unlimited free Two-Day Shipping has grown from one million to over 20 million. We also added unlimited access to over 40,000 movies and TV episodes with Prime Instant Video and a selection of over 500,000 books to borrow from the Kindle Owners' Lending Library.",45 – Retail Trade,454110 – Electronic Shopping and Mail-Order Houses,20-Jun-14,"Cost, quality","Cost, quality",Yes,330.23803226804125,103
Citi bike,Citi Bike Annual Membership,"To improve bikesharing in New York City, we'll be increasing prices to support our growing operations and continued expansion. This means you'll see more station upgrades and next-gen ebikes, doubling the size of our fleet. Citi Bike's Annual Membership price will increase on Jan. 29. Certain other Citi Bike prices will increase on Jan. 4. Reduced Fare Bike Share members will continue to pay $5/month.",48 – Transportation and Warehousing,485990 – Other Transit and Ground Passenger Transportation,29-Jan-24,Quality,Quality,Yes,351.5734587301587,65
AT&T,AT&T TV NOW (Streaming TV Service),"Thank you for being an AT&T TV NOW customer. We hope you have been enjoying all the endless entertainment you love-anytime, anywhere, on your favorite devices.We wanted to let you know that as programming costs continue to rise, the price of your AT&T TV NOW package will be increasing to $60 starting with your 12/5/2019 payment.The price increase will not affect the cost of add-ons, like 3rd stream or premium channels, nor will it affect any discounts you may already receive on your account.As always, you can review your options for packages and prices, or if you do not wish to continue your subscription, you can cancel any time.",51 - Information,515120 – Television Broadcasting or 519130 – Internet Publishing and Broadcasting,5-Dec-19,Cost,Cost,Yes,324.2897920909091,109
AT&T,AT&T TV NOW (Streaming TV Service),"Thank you for subscribing to AT&T TV NOW and being a valued customer. We appreciate your business and are proud to be part of your entertainment-anytime, anywhere, on your favorite devices. Periodically, television networks increase the fees they charge AT&T for the right to broadcast their movies, shows and sporting events. Due to increased programming costs, the price of your AT&T TV NOW package will increase to $2021- 04-28 a month, and your total monthly charge will go up by $9.99 starting with your 69.99 payment. The price increase will not affect the cost of add- ons, like premium channels (e.g., Epix, CINEMAX, SHOWTIME, STARZ, HBO MaxTM), nor will it affect any discounts you may have already received.",51 - Information,515120 – Television Broadcasting or 519130 – Internet Publishing and Broadcasting,28-Apr-21,Cost,Cost,Yes,334.52744781818177,118
BT Broadband,Home Phone and Broadband Internet Services,"We're changing your prices in line with CPI inflation. We want to be transparent with the way we price your phone and broadband service. That's why, unlike Sky and Virgin Media, we're changing our prices in line with the Consumer Price Index (CPI) rate of inflation. CPI is calculated monthly by the Office for National Statistics to see how much the average price of goods changes year on year. Based on this rate: your prices will go up 1.3% from 31 March. A price change on your phone and broadband service will happen once a year, shortly after the new January CPI rate is announced. See below for your pricing information.",51 - Information,517311 – Wired Telecommunications Carriers,31-Mar-24,Cost,Cost,Yes,341.1674450943396,111
Comcast,HBO and HBO Max Subscription (via Comcast/Xfinity),"Effective April 3, 2023, the monthly subscription for HBO and HBO Max will increase from$14.99 to $15.99 per month as a result of a recent increases in HBO and HBO Max programming costs.",51 - Information,515120 – Television Broadcasting or 519130 – Internet Publishing and Broadcasting,3-Apr-23,Cost,Cost,Yes,341.8460603846154,33
Flickr Pro,Flickr Pro Subscription (Photography Hosting & Tools),"We're writing to inform you that effective today, the price of Flickr Pro subscriptions has increased. To thank loyal Pro members for your continued support, we are offering all current Pros the opportunity to renew now at last year's price. Click here to extend your subscription term now.Why has the price changed? Please see last month's letter from Flickr's CEO and Chief Geek, Don MacAskill. In short: Flickr is a huge and extremely costly service to run. We intend to keep investing in making it even better, but it cannot continue to operate at a loss.",51 - Information,519130 – Internet Publishing and Broadcasting and Web Search Portals,21-Jan-20,Cost,Cost,Yes,324.6490475157894,96
Google,Google Cloud Compute Engine – Custom Machine Types (VMs),"Starting February 1, 2024, theon-demand pricesof N1, N2, and N2D custom machine types will change. StartingFebruary 1, 2024, theon-demand prices and SKUsof E2 and G2 custom machine types will change. StartingMay 1, 2024, you will be charged a premium on the prices of your1-year and 3-year commitmentsif you use them for VMs of custom machine types. Additionally, new premium SKUs will be introduced for these custom machine types. To ensure the consistent application of a 5% price premium charge on the prices for all custom machine types over the predefined shapes in the same machine series, Google Cloud is introducing changes to the prices and SKUs of Compute Engine custom machine types. These changes will apply to both on-demand and committed use discount (CUD) usage. This pricing change is being introduced for the following reasons:To clearly communicate the cost of custom machine types to customers and eliminate the existing confusions that surround the pricing. This change will make pricing consistent, clear, and transparent.To support the rising costs involved in maintaining custom machine types of different shapes. This change will ensure that the pricing model allows Google Cloud to continue offering custom machine types in the future.",51 - Information,"518210 – Data Processing, Hosting, and Related Services",1-Feb-24,Cost,Cost,Yes,336.2222696,196
MEO,"Telecommunications Services (Internet, Mobile, and TV Packages)","In recent months we have seen a substantial and widespread increase in prices, which has had a strong impact on family and company budgets. The telecommunications sector has been no exception and has also been significantly impacted, especially with: Increased energy costs: To bring our services to you, we keep our data centers, machines, and servers permanently connected.Increased equipment costs: The worldwide shortage of components has led to rising costs for various equipment essential to our operations. The telecommunications sector has been particularly affected by this.This has been the case since 2021. So far, we have absorbed this increase in costs and not reflected it in the prices of our services.However, in order to continue providing you with a quality service, it is inevitable that we update the monthly fee for our services. In this regard, please consul there the prices of the monthly fees in force as from 01-02-2023, updated by application of the Consumer Price Index for the calendar year 2022. ",51 - Information,517311 – Wired Telecommunications Carriers,2-Jan-23,Cost,Cost,Yes,321.07937068322985,163
NameSilo,.COM Domain Name Registration and Renewal,"We have been informed that Verisign will be increasing prices for .COM domains starting on September 1, 2023. This means that, unfortunately, NameSilo will need to do the same. We are contacting you because you have active or expired .COM domain(s) in your account. There is still time to take advantage of the current lower prices by renewing your existing domains for multiple years and registering any new .COM names before September 1st. You can disregard this email if you have already renewed your domain(s) recently. Our new prices for .COM domain(s) will be as follows: Registration: 1‚49 domains in one order: $13.95 USD/domain; 50‚100 domains: $13.65 USD/domain; 101‚500 domains: $13.35 USD/domain. Renewal: $13.95 USD/year. New Discount Program Pricing (active account domains): 0+ = $11.95; 100+ = $10.40; 500+ = $10.30; 1000+ = $10.20; 2500+ = $10.10; 5000+ = $10.00. Mitigation: 1. We are advising you renew all the .COM domain(s) you wish to keep before September 1st in order to renew at the current prices. 2. Sign up now for our Discount Program to start saving even more on your registrations and renewals. Please note that the max age for .COM domain(s) is 10 years, therefore, you can renew them today up to 2033. ",51 - Information,519130 – Internet Publishing and Broadcasting and Web Search Portals,1-Sep-23,Market,Cost,Yes,316.1181027380952,205
