Firm,Product/service,Letter,NAICS2,Industry,Date,JustificationType (LLM Label),JustificationType (Authors' Label),Subscription,Concreteness,Length
O2,Mobile Plan,"Every year, we adjust the prices of our products and services to be in line with the Retail Price Index (RPI) rate of inflation as is set out in your terms. From April 2024, the monthly price of your mobile plan will be increasing. We're letting you know now so you can plan ahead and be prepared. As demand for data continues to rise, we need to remain committed to investing in our network technology, coverage and services. In 2023, we added extra 4G capacity to over 465,000 postcodes across the UK, brought 5G to over 50% of the population*, and expanded coverage into 100 of the most remote places across the UK. ",51 – Information,517312 – Wireless Telecommunications Carriers (except Satellite),1-Apr-24,"Cost, quality","Cost, market, quality",Yes,321.5165309615385,113
Paramount+,Paramount+ Subscription,"Paramount+ is in the process of getting even bigger, with many additions of blockbuster movies, new originals and exclusive series, plus a wide variety of hit drama, action, reality, comedy and kids shows. It's a mountain of entertainment. The price as of November 1, 2022 for new users will be $9.99 CAD monthly or $99.99 for annual users. If you're already a subscriber, your renewals on or after December 1, 2022 will be at this new rate.",51 – Information,515120 – Television Broadcasting,1-Nov-22,Quality,Quality,Yes,337.65973191780824,77
Philo TV,TV streaming service,"The summary is that as of June 8th we are changing our price for new subscribers to $25. Everyone who is subscribed to Philo before June 8th will keep their current package and their price won't change. As part of the new $25 package, we are also extending the time we keep recordings in our unlimited DVR from 30 days to a year, and existing subscribers can upgrade to this plan if they want access to the extended DVR. So, why are we doing this? Maybe this seems like a strange question to ask since it is common for TV services to raise their prices year after year, sometimes by eye-popping amounts. Still, at Philo, we haven't raised our prices since we launched more thanAs many of you know, our contracts with our content partners include fees we pay that go up every year, and a significant part of the cost of Philo is driven by our platform and billing partners. We are relentless in our focus on keeping our price low, so we do everything we can to reduce our overhead while managing these increasing costs. Even with those efforts, we can't offset these rising costs indefinitely, and this change reflects that reality. Still, we have chosen to make this transition in a way that allows our existing subscribers to keep the package and pricing they currently enjoy, while new subscribers gain the added value of the newly extended DVR three and a half years ago, even as we've continued to add content to the platform, so why do it now?",51 – Information,519130 – Internet Publishing and Broadcasting and Web Search Portals,8-Jun-25,Cost,"Cost, quality",Yes,313.7604727165355,262
PlayStation,PlayStation Vue Core Slim Plan,"Effective today, PlayStation Vue is transitioning Core Slim plans to a nationwide price of $44.99/mo* for new customers. As a valued existing customer, you will keep Core Slim at the price of $34.99/mo* for 3 billing cycles until October 27, 2017. During this period, any changes to your plans will reflect the currently available pricing. To learn more about this transition, please visit our FAQ page. Thank you for being a valued PlayStation Vue customer and please know we continuously seek ways to enhance the service including personalized features, simultaneous streams and no annual contract.",51 – Information,517311 – Wired Telecommunications Carriers,27-Oct-17,Quality,Quality,Yes,326.7658004651163,95
PlayStation,PlayStation Plus Premium 12-Month Subscription,"The price for your current PlayStation Plus Premium 12 month subscription will be increased to USD 159.99. This price adjustment will enable us to continue bringing high-quality games and benefits to your PlayStation Plus subscription service. This price increase will not take effect until your next renewal date that occurs on or after November 6th. However, any membership changes you make prior to your next renewal, such as upgrades, downgrades or buying additional time, will update your plan based on the new prices. You can change or cancel your subscription at any time, details here.",51 – Information,517311 – Wired Telecommunications Carriers,30-Aug-23,Quality,Quality,Yes,326.21656600000006,95
PlayStation,PlayStation Plus 12-Month Subscription,"We also wanted to let you know that starting September 6 we will be increasing the price for PlayStation Plus 12-month subscriptions globally across all benefit plans. This price adjustment will enable us to continue bringing high-quality games and value-added benefits to your PlayStation Plus subscription service. Here are the new prices for PlayStation Plus 12-month subscription plans.PlayStation Plus Essential 12-Month Subscription79.99 USD | 71,99 Euro | 59.99 GBP | 6,800 YenPlayStation Plus Extra 12-Month Subscription134.99 USD | 125,99 Euro | 99.99 GBP | 11,700 YenPlayStation Plus Premium 12-Month Subscription159.99 USD | 151,99 Euro | 119.99 GBP | 13,900 YenThe new prices for the 12-Month subscription will remain at a discounted rate when compared to purchasing the 1-Month or 3-Month subscriptions over a 12-month period. For current 12-month subscribers, this price increase will not take effect until your next renewal date that occurs on or after November 6. However, any membership changes you make on or after September 6, such as upgrades, downgrades or buying additional time, will update your plan reflecting the new prices.  You can change or cancel your subscription at any time, details here.We'll notify current subscribers of these changes via email and will have additional details on our website soon.",51 – Information,517311 – Wired Telecommunications Carriers,6-Sep-23,Quality,Quality,Yes,324.6604263855422,204
PlayStation,PlayStation Plus Essential 12-Month Subscription,"We want to let you know about an upcoming price change to your PlayStationPlus subscription.The price for your current PlayStation Plus Essential 12 month subscription will be increased to CAD 109.99. This price adjustment will enable us to continue bringing high-quality games and benefits to your PlayStation Plus subscription service.This price increase will not take effect until your next payment date that occurs on or after June 24, 2025. However, any membership changes you make prior to your next payment, such as upgrades, downgrades or buying additional time, will update your plan based on the new prices. You can change or cancel your subscription at any time, details here . Please find the PlayStation Plus Usage Terms here.Thanks for your continued support,",51 – Information,517311 – Wired Telecommunications Carriers,24-Jun-25,Quality,Quality,Yes,324.0835931034483,122
Plusnet,"Broadband, phone, and mobile services provider","Each year, we adjust the prices of our products and services in line with the Consumer Price Index (CPI) rate of inflation, plus 3.9%. When we work out our prices, we use the December CPI rate published in January. For December 2023, the CPI rate was 4%. This means that the majority of our customers will see a price increase of 7.9% (which is 4% plus 3.9%), or less than ¬£2.50 a month on average. These price changes take effect on or after 31st March 2024. We know that your home relies on a brilliant connection and it's more important than ever to keep everyone and everything connected. Our annual price change helps us continue to invest to bring you a better, more reliable experience and the best value for your money. It's also important as our own costs continue to increase, so the price change means we can continue to maintain the best networks and provide customer service in more ways than ever before.",51 – Information,517311 – Wired Telecommunications Carriers,31-Mar-24,"Cost, quality","Cost, quality",Yes,318.94691812903227,165
Private Internet Access ,Private Internet Access VPN Subscription,"Recently we sent an email informing all of our users that we will be increasing our subscription prices, and our commitment to provide our users with a better VPN service and application.With the recent changes, we have created this article to address some common questions.1. When will the price increase take place?The price change will happen no earlier the March 18th for all subscription lengths2. Am I eligible for the device limit increase if I decide not to take advantage of the 3-year deal?Yes, we now will be allowing all subscriptions to enjoy up to 10 devices.3. What happens to my current subscription if I do not want to upgrade?As long as your current account remains active your account will be grandfathered into your existing subscription price.The price increase will not affect your account unless you terminate or purchase a new account, on or after March 18th.4. What if I already have an active subscription?Your account will not increase in price, it will remain the same for as long as the account remains active5. Why was my renewal date changed?If you have upgraded your account to a yearly, 2 years or our new 3 year promotional subscription. Our system registers this upgrade process as a new transaction and restarts your account anew at the date in which you have upgraded. 6. How do I upgrade?To upgrade your account you will need to log into your client control panel located on the 'My Account' page here: https://www.privateinternetaccess.com/pages/client-sign-in7. When I selected upgrade my 3-year account started immediately instead of when my current account terminates why?There was a miscommunication in the wording of our email; instead of having your upgrade begin when your current account ends, the upgrade will take place immediately and our system will prorate the remaining balance onto your original account towards the $99 prices.8. Why can't I upgrade my PayPal account to the 3-year deal?PayPal has recently upgrading their payment processor to a system called Braintree. if you have had your subscription for an extended amount of time you are most likely using their legacy processor and will not be able to take advantage of this new promotion without creating a new account.9. Why are you increasing your prices?This price increase will allow us the ability to provide you with new features without sacrificing security or privacy.  Visible changes include the new look of our Desktop application as well as the increase of our device limit from 5 to 10.",51 – Information,"518210 – Data Processing, Hosting, and Related Services",18-Mar-19,Quality,Quality,Yes,320.9944844887781,411
Rogers,Ignite Bundle,"With our Ignite Bundle services, we're committed to delivering dependable WiFi throughout your home and next-generation TV technology to deliver you the best entertainment experience. We're continually investing in our network to provide quality service and capacity to help enhance your digital life. While we try to minimize the impact on our customers, we occasionally make changes to some of our rates. Here's how this change will affect you: On the date of your first bill after October 19, 2020, the monthly service fee for your Ignite Bundle will increase by $6 plus taxes. For your current rate, please refer to your most recent bill. If you currently have a discount off your monthly rate, this discount will still apply to the new rate until your promotional period ends. If you'd like an updated Residential Service Agreement after this change takes effect, please call or chat with us at that time by visiting rogers.com/contactus and clicking on General Inquiries. The rest of your Ignite Bundle will remain the same. This change is made in accordance with the CRTC Internet and Television Service Provider Codes.",51 – Information,517311 – Wired Telecommunications Carriers,19-Oct-20,Quality,Quality,Yes,329.6809253038674,184
Rogers,Wireless Plan,"To continue delivering wireless experiences that make more possible, we regularly review and adjust our plans. While we try to minimize the impact on our customers, the monthly service fee for your wireless plan shown on this bill will increase by $5 (plus taxes) starting on the date of your first bill after April 4, 2022. Rest assured, your plan continues to offer excellent value on Canada's Largest and Most Reliable 5G Network*. The rest of your Rogers wireless service will remain the same. This change is made in accordance with the CRTC Wireless Code. If you have any questions or no longer wish to subscribe to your wireless services, please reach out to us in any of the ways listed in the Contact Us section of this bill.",51 – Information,517312 – Wireless Telecommunications Carriers,4-Apr-22,Quality,Quality,Yes,326.7516059677419,129
Rogers,Internet and Home Phone Services,"We continually invest in our network to bring you the best-connected experience in Canada. To help support these investments, we will be increasing the monthly fee for your internet service by $7 and your home phone service by $5 (plus taxes) starting your first bill on or after April 1, 2025. Any active discount or guaranteed rate will remain in effect until its end date. Services included as part of your condo maintenance or property rental fees are not impacted. The rest of your services remain the same.",51 – Information,517311 – Wired Telecommunications Carriers,1-Apr-25,Quality,Quality,Yes,326.6310738554217,88
Sacramento Bee,The Sacramento Bee Subscription,"Thank you for subscribing to The Sacramento Bee. We hope you're taking advantage of your subscription benefits, including unlimited access to our website, mobile apps and the eEdition ‚ the digital replica of the daily print paper. IMPORTANT RATE INFORMATIONWe appreciate your participation in our EZ Pay program. As part of ongoing efforts to provide you with the best local journalism, we have updated your subscription rate. Your new renewal rate will be $19.99 per month (plus tax if applicable). This change will be effective with your next payment.",51 – Information,511110 – Newspaper Publishers,,Quality,Quality,Yes,323.3405112048193,89
Shudder,Shudder Subscription,"Thank you for being a valued Shudder subscriber. We wanted to let you know about upcoming changes to your subscription. As part of our commitment to improve Shudder, we are changing the price of Shudder subscriptions.As an existing subscriber, your new rate of $6.99/month (plus applicable taxes) will be reflected on your next billing cycle on or after October 19, 2023.If you are currently on an offer, your promotional pricing will continue through the end of the promotional period. If you cancelled your subscription within the last 30 days, please disregard this notice; you will not be charged after the end of your current billing cycle.",51 – Information,515120 – Television Broadcasting,19-Oct-23,Quality,Quality,Yes,315.99724745098035,106
Sky,Sky Broadband Ultrafast Plus,"Here's a summary of your Broadband changes:Effective from 1 April 2025, the service(s) below will have the following price change(s) per month:Sky Broadband Ultrafast Plus+¬£3.00We hope you'll continue to enjoy our services, but if you're not happy with these changes, you can cancel your Sky Broadband and/or Talk service(s). Information on the changes and how to cancel can be found at sky.com/changes. If you're within your minimum contract period, call us within 30 days of getting this email to avoid early termination charges. Unless you tell us otherwise, your Sky subscription will continue as normal.We're committed to bringing you the best broadband experience possible, and we're thrilled that this has been recognised with the public naming Sky Broadband the most popular provider at the Uswitch Telecoms Awards 2024.",51 – Information,517312 – Wireless Telecommunications Carriers (except Satellite),1-Apr-25,Quality,Quality,Yes,328.06021992187505,128
Spectrum TV,"Television & Voice Services (Spectrum TV Silver, Broadcast TV, Receiver, Voice)","At Spectrum, we work hard to earn your business. We continue to enhance our services in order to provide the best communication and entertainment products. Our goal is to provide the best services at the best value. We are passing through the increased programming fees charged by the TV networks we carry. The fees continue to rise, despite our best efforts to contain them. Effective with your next statement, the following fee(s) will change: Spectrum TV Silver will increase by $8/mo. Broadcast TV Surcharge will increase by $1.54/mo. Each Spectrum Receiver will increase by $1/mo. Spectrum Voice will increase by $3/mo.",51 – Information,517111 – Wired Telecommunications Carriers,1-May-21,Cost,"Cost, quality",Yes,333.7887084313725,101
Spotify,Spotify Premium Subscription,"Since launching in 2008, Spotify has innovated and invested to build the best audio experience for you and your favorite artists and creators. We have continually revealed new opportunities for fans and creators to connect through the power of our platform, from discovery tools like our new AI DJ, to fan-favorite shared experiences like Blend and the introduction of podcasts and audiobook content. With 200+ million Premium subscribers, we're also proud to be the world's most popular audio streaming subscription service, giving Premium users access to on-demand and ad-free music listening, offline music downloads, and quality music streaming. The market landscape has continued to evolve since we launched. So that we can keep innovating, we are changing our Premium prices across a number of markets* around the world. These updates will help us continue to deliver value to fans and artists on our platform.Starting from today, existing subscribers in these markets will receive an email explaining what this means for their account. ",51 – Information,519130 – Internet Publishing and Broadcasting and Web Search Portals,24-Jul-23,"Market, quality",Quality,Yes,330.53422741935486,162
Spotify,Premium Family Subscription,We are increasing the price of Premium Family so we can continue to bring you new content and features that you can enjoy as a family and as individuals.,51 – Information,519130 – Internet Publishing and Broadcasting and Web Search Portals,30-Apr-21,Quality,Quality,Yes,325.6112427586207,29
Spotify,Spotify Premium Family Subscription,"Thank you for being a Premium subscriber. Starting on your billing date in June, your subscription price will change from A$20.99/ month to A$23.99/month. We're increasing the price of Premium Family so we can continue bringing you the best experience. You'll continue to get the benefits that you know and love today, like ad-free music listening and downloading to listen offline. As a Premium subscriber, you can also do more with your Spotify music listening: discover familiar favourites and new finds with your own personal DJ, and host real-time listening sessions with friends and family by starting a Jam on your phone and desktop.",51 – Information,519130 – Internet Publishing and Broadcasting and Web Search Portals,31-May-25,Quality,Quality,Yes,339.80647865384617,104
Spotify,Spotify Premium Individual Subscription,"Thank you for being a Premium subscriber. Starting on your billing date in July, your subscription price will change from $10.99/month to $11.99/month. We're increasing the price of Premium Individual so that we can continue to invest in and innovate on our product offerings and features, and bring you the best experience.Thank you for choosing Premium. If you do not wish to continue paying for Premium at the new price point, you can always cancel via your account page or visit our support site if you have more questions.*If you're currently on a trial, you won't be charged until your trial ends. Once your trial ends you will be given 1 month on the current price of $10.99 prior to your bill being increased to $11.99.",51 – Information,519130 – Internet Publishing and Broadcasting and Web Search Portals,31-May-25,Quality,Quality,Yes,326.25108960937496,126
Stan,Stan Subscription,"In 2017 Stan is fast tracking more of the biggest and best shows from around the world and making our biggest lineup of Stan Originals yet including Matt Okine's The Other Guy and a brand new season of Wolf Creek.From August, the price of your subscription will change to $12 and your terms and conditions will be updated. With offline viewing now included, Stan continues to give you more choice and more ways to watch your favourite shows.Our team is always here to help so if you have any questions please contact Stan Support here.",51 – Information,515210 – Cable and Other Subscription Programming,1-Aug-17,Quality,Quality,Yes,331.34500473118277,95
Starlink,Starlink Residential Internet Service,"Due to excessive levels of inflation, the price of the Starlink kit is increasing from $499 to $549 for deposit holders, and $599 for all new orders, effective today. In addition, the Starlink monthly service price will increase from $99 to $110. The new price will apply to your subscription on 5/20/2022. The sole purpose of these adjustments is to keep pace with rising inflation. If you do not wish to continue your service, you can cancel at any time and return your Starlink hardware within your first year of service for a partial refund of $200. If you have received your Starlink in the past 30 days, you can return it for a full refund. ",51 – Information,517410 – Satellite Telecommunications,20-May-22,Cost,Cost,Yes,312.00877240384614,116
Starlink,Starlink Residential Internet Service,The Starlink monthly service for residential customers is changing as follows:$10 increase in areas with limited capacity. New price will be $120/month.$20 decrease in areas with excess capacity. New price will be $90/month.,51 – Information,517810 – All Other Telecommunications,,Market,Market,Yes,340.0588728125,33
Starlink,Starlink Residential Internet Service,"As a current customer in an area with limited capacity, your monthly service price will increase to $120 per month beginning June 10, 2024.",51 – Information,517810 – All Other Telecommunications,10-Jun-24,Market,Market,Yes,356.63147285714285,24
Starlink,Starlink Residential Internet Service,"The monthly service price of ""Mobile - Global"" is increasing to $670. As a current customer, your monthly service price will increase in 3 months, beginning 16/8/2024. For new customers, the price increase is effective immediately. If you do not wish to continue service, you can cancel at any time on your account page. You can receive a full refund of hardware and service if your Starlink is returned within 30 days of purchase or half refund of the hardware if purchased within the last year.",51 – Information,517311 – Wired Telecommunications Carriers,16-Aug-24,No-justification,No-justification,Yes,330.909861,86
Starlink,Starlink Residential Internet Service,"The monthly service price of ""Residential"" is increasing to ‚Ç±3,800 on May 16, 2025.As a current customer, you will receive a service credit equal to the difference in price, which will be applied towards your next invoice. For new customers, the price increase is effective immediately.If you do not wish to continue service, you can cancel at any time on your account page. You can receive a full refund of hardware and service if your Starlink is returned within 30 days of purchase or half refund of the hardware if purchased within the last year.Thanks for being a customer and for your continued support of Starlink!",51 – Information,517311 – Wired Telecommunications Carriers,16-May-25,No-justification,No-justification,Yes,323.12435262135926,106
StartTimes,StarTimes Bouquet Subscription,"To keep giving you great content without reducing quality, we're reviewing bouquet prices and adding a new bouquet. Starting from January 10, these prices will take effect. We remain committed to giving you the best. Thank you for choosing StarTimes",51 – Information,515210 – Cable and Other Subscription Programming,10-Jan-24,Quality,Quality,Yes,323.1924405128205,40
Summit Broadband,Television Service (Summit Broadband TV),"Starting January 1, 2025, Summit Broadband customers across our service area will see some rate increases to their monthly statement. These rate increases reflect rising costs to our business and other factors associated with improving, expanding, and enhancing our service offerings. Rate increases will impact customers who pay for TV service that is not included in a bulk agreement with your HOA or residential community. Customers who receive their TV service as part of their monthly HOA fees and do not pay a separate monthly bill to Summit Broadband will not see an increase in their fees. In addition, some regulatory and programming costs to Summit Broadband are rising, and those increases are reflected in the fee increases. Although we strive to minimize the number of annual increases and absorb most of the increasing programming costs every year, among others, from time to time we may adjust the product and service fees. These increases help not only cover part of the rising costs to our business but also help us to consistently improve our network, products, and services.",51 – Information,517311 – Wired Telecommunications Carriers,1-Jan-25,"Cost, quality","Cost, quality",Yes,333.1792939053255,178
