Firm,Product/service,Letter,NAICS2,Industry,Date,JustificationType (LLM Label),JustificationType (Authors' Label),Subscription,Concreteness,Length
Curaleaf,Cannabis flower products,"We are writing to inform you that, with effect from 1st August 2024, some of our existing range of flowers will be slightly increasing in price but will remain at a competitive price point. Higher pricing of some of our flowers is a direct result of improvements in our cultivation and new processes, as well as increases on production and raw material costs.","11 – Agriculture, Forestry, Fishing and Hunting","111419 – Other Food Crops Grown Under Cover, often used for greenhouse cultivation including cannabis",1-Aug-24,"Cost, quality","Cost, quality",No,326.8435101639344,63
Ames Lake Water Assoc.,Water Service,"Dear ALWA Member,Over the past 10 years, we have upgraded and modernized the water system, by replacing key components of thecritical infrastructure, resulting in increased efficiency, reliability, and security. Most importantly, we have been able to make these capital improvements with only two minor increases in our water rates over that 10-year period. But now we are about to tackle our largest infrastructure project in ALWA history, which is replacing the watermain around Ames Lake. This massive project is part of our 10-year water system plan, which has been approved by the Washington State Department of Health. Because of the sheer size of this project, we will need to raise water rates and add a CIP (Capital Improvement Plan) charge to everyone's monthly bill. These new charges are effective starting with your May 2024 water bill. What we are doing: over the next 8-10 years we will be gradually replacing the water main around the lake. Even if you don't live anywhere close to Ames Lake itself, your water supply is dependent on this infrastructure as we use the watermains around the lake to distribute water to every other part of our water system. The water main replacement will be done in stages, so only one part of the road around the lake will be under construction at any one time. Plenty of notice will be given before construction starts. How your bill will be impacted: there are two ways you will see your bill change with the new water rates: a Capital Improvement Charge (labeled as CIP on your bill) of $11 will be added to every monthly bill. The amount you are paying for water will also go up, with every tier seeing a 5% increase to the existingrate, plus an additional charge of 10 cents per 100 gallons of water.Examples of how your bill will increaseTo give you a better idea of how these new charges will impact your bill, we have put together a few examples foryou:‚ If your bill is normally $40 per month (19% of our customers)o Your new monthly bill will be $53 per month. If your bill is normally $55 per month (43% of our customers) Your new monthly bill will be $72 per month. If your bill is normally $70 per month (18 % of our customers)o Your new monthly bill will be $90 per month.These increases are taking place effective April 1, 2024. So, your next bill will reflect the updated charges.",22 – Utilities,221310 – Water Supply and Irrigation Systems,1-Apr-24,Quality,Quality,Yes,335.9937979586564,412
Johns Manville,Building Insulation Products,"Dear U.S. Building Insulation Customer:Johns Manville is announcing a price increase effective July 15, 2024. This price increase will apply to all orders shipped on or after July 15, 2024, regardless of the date of orderplacement. Please check with your Customer Advocate as this date approaches for information on currentproduct lead times.Johns Manville recommends placing orders early. Johns Manville reserves the right to monitor all orders placed between now and the date of increase and limit quantities if necessary. If you have any questions about the implementation of this increase, please contact your SalesRepresentative or Account Manager. Thank you for your ongoing support of JM products",23 – Construction,238310 – Drywall and Insulation Contractors,15-Jul-24,No-justification,No-justification,No,333.8795874736842,106
Coca-Cola Bottlers Japan,"Bottled Beverages (Coca-Cola, Fanta, etc.)","Coca-Cola Bottlers Japan Inc. today announced price revisions for certain products, effective for shipments from May 1, 2024. The cost of conducting business activities has continued to rise against the backdrop of a prolonged period of high raw material and energy prices alongside exchange rate fluctuations. Under these circumstances, we have made the utmost efforts in our business activities to improve production and operational efficiency, as well as reduce costs. Despite such efforts, market conditions make it difficult to continue absorbing the impact of increased costs through our corporate efforts alone. In response to this situation, we have decided to implement further price revisions for certain products. We will continue our efforts to improve efficiency and reduce costs through corporate efforts. We are committed to continuously providing our customers and consumers with high-quality products and services. We thank you for your understanding in this matter.",31 - Manufacturing,312111 – Soft Drink Manufacturing,1-May-24,Cost,Cost,No,322.3417132867133,145
Games Workshop,Warhammer Plastic Miniatures and Model Kits,"We're sure it hasn't escaped your notice that a lot of things are more expensive than they used to be: food, materials, transport ‚ essentials and luxuries alike. Stuff costs more to make and more to move, and Warhammer is not immune to these changes. This means that from the 6th March we'll be increasing some prices. The average change for plastic kits is about 6%. As an example of what you can expect, a Battle Sisters Squad goes up ¬£1.50 from ¬£36 to ¬£37.50.*We understand that no one likes a price rise. We've done our best to keep prices down on some of your hobby essentials, and we're giving you a heads-up now so that you have plenty of time to take advantage of current prices. ",31 - Manufacturing,"339930 – Doll, Toy, and Game Manufacturing",6-Mar-23,Cost,Cost,No,325.46592231999995,127
Kimai,"Lab-Grown Diamond Jewelry (Handmade, Ethical)","As you know, tomorrow our prices will increase. We know this isn't the news you want to hear but we thank you for your continuous support and are humbled by all the positive reactions we've received since first announcing this. We commit to always being as transparent as possible. In order to run a more sustainable business that continuously offers high quality craftsmanship, our prices need to reflect the numerous increases we've dealt with in the past year. Making this small adjustment will allow us to continue creating the premium handmade jewelry you are familiar with, whilst maintaining a fair wage to all of our partners.",31 - Manufacturing,339910 – Jewelry and Silverware Manufacturing,9-Jun-25,Cost,Cost,No,311.7154351428572,106
The LEGO Group,LEGO Construction Toys and Sets,"The current global economic challenges of increased raw material and operating costs are impacting many businesses. Putting consumers first is at the heart of what we do as a company, and for some time, we have absorbed these costs to keep pricing stable. However, as these costs have continued to rapidly rise, we have taken the decision to increase the price on some of our sets. This increase will come into effect in August and September.",31 - Manufacturing,"339930 – Doll, Toy, and Game Manufacturing",1-Jun-22,Cost,Cost,No,320.69570513157896,76
Alpha Wire,Wire and Cable Products,"Alpha Wire makes every effort to minimize the impact of cost increases, however, business conditions have necessitated a price change across many of our product lines in North America. Effective April 5, 2021, pricing on our product offering will increase by 6-7%. These increases are primarily driven by continued rising costs for raw materials, resin compounds and packaging. Please share this information across your internal teams. To provide you with adequate time to update your systems, the new pricing files will be made available today through our DISTe portal. ",31 – Manufacturing,"331420 – Copper Wire, Wire Rod, and Cable Manufacturing",5-Apr-21,Cost,Cost,No,342.8861656470589,89
Ashland,1-4 Butanediol (BDO) and solvents,"Ashland increases prices for 1-4 Butanediol intermediates and solvents product range globally. Ashland is increasing prices on 1-4-Butanediol (BDO) and several solvents products as indicated below: Product Amount of increase1-4 butanediol (BDO) Min $0.33 per kg (equivalent in euro), gamma-butyrolactone (BLO) Min $0.33 per kg (equivalent in euro), n-methyl-pyrrolidone (NMP) Min $0.40 per kg (equivalent in euro), tetrahydrofuran (THF) Min $0.40 per kg (equivalent in euro). These increases apply to all regions and are effective March 15, 2025 or as agreements allow. These price increases will allow Ashland to continue providing high quality products and services to customers.",31 – Manufacturing,325199 – All Other Basic Organic Chemical Manufacturing,15-Mar-25,Quality,Quality,No,332.53981984848485,98
Castrol,Castrol Lubricants Products,"Please be advised that Castrol Lubricants will generally increase prices up to 4% on all Passenger Car, Motorcycle, Commercial and ancillary products, including synthetics, in all package types, effective Monday June 18, 2012. In some instances, price changes for certain products may fall outside of this general percentage amount. All orders received on or after Monday June 18, 2012 will be invoiced at the new price. Orders must be received by BP before 5 pm central time on June 15, 2012 in order to receive the pre-increase price. All orders received by Friday June 15, 2012 will be shipped within the standard lead time. Beginning Monday May 21 and continuing through Friday June 15, 2012, Castrol will monitor customer orders and limit customers to 110% of their average monthly purchases for the past 6 months. Castrol reserves the right to cancel or delay orders exceeding the 110% allocation.As always, we are committed to providing superior products and services to you in the continued development of your business. We very much appreciate your business and continued support.",31 – Manufacturing,324110 – Petroleum Refineries,15-Jun-12,Quality,Quality,No,329.489442967742,176
IMM,Barcel Products,"We're adjusting Barcel product prices on April 10. IMM is increasing our pricing for Barcel products. This includes Takis, Churritos, Peanuts, Barcel Chips, and Ricolino candy. Nonetheless, we will strive to continue providing value to all our customers by: - weekly or biweekly service- credit for expired product- additions to our product portfolio- free POP marketing materials - online shopping at immlatino.com (5% discount on first order)- One Stop Latino Shop for all Latino food & beverage",31 – Manufacturing,311919 – Other Snack Food Manufacturing,,Market,Quality,No,357.7144753333334,77
The Hershey Company,"Foodservice items (e.g., bulk confectionery and food products sold to foodservice customers)","The Hershey Company is dedicated to driving growth through traditional investments and new evolving capabilities. Ongoinginput costs jeopardize Hershey's ability to continue to sustain these levels of investment into the business. Therefore, a pricingaction is critical to support continued growth for our customers and enable delivery of Hershey's strategy.Hershey Foodservice is announcing the following price changes today, October 9, 2024, to be effective at 12:01 a.m. onJanuary 15, 2025, on select Food Service items. A Hershey sales representative will provide each customer with its affected items and pricing.Pricing Policy and Execution Details:Product ordered prior to, on or after the announcement date of October 9, 2024, calling for delivery, within normal lead-times,prior to the effective date of January 15, 2025, will be priced at the current price.Product ordered prior to the announcement date of October 9, 2024, calling for delivery on or after the effective date ofJanuary 15, 2025, will be priced at the new, higher price.Product ordered on or after the announcement date of October 9, 2024, calling for delivery, within normal lead-times, on orafter the effective date of January 15, 2025, will be priced at the new, higher price.During the advance notice period between October 9, 2024, and January 15, 2025 (‚Advance Notice Period), customers will bepermitted to order the affected items at historical levels only as measured by the comparable time period in the previous year(‚Allowable Order Limits). All customers will be held to these order limits. Any orders during the Advance Notice Period thatexceed the Allowable Order Limits may be reduced to the allowable maximum at Hershey's discretion. An order can be limited,or further limited, if Hershey's inventory level is restricted, there is a risk of broader service issues or, as noted, if the order isabove the Allowable Order Limits.Thank you for your continued partnership with Hershey.",31 – Manufacturing,311351 – Chocolate and Confectionery Manufacturing from Cacao Beans,15-Jan-25,Cost,Cost,No,320.95996853046597,300
Trinseo,STYRON and STYRON A-TECH High Impact Polystyrene Grades,"Effective from March 22, 2024, or depending on existing contract terms, the price for the product listed below will increase as follows: STYRON‚Ñ¢ and STYRON‚Ñ¢ A-TECH high impact polystyrene grades (HIPS) will increase by USD $85 per metric ton.",31 – Manufacturing,325211 – Plastics Material and Resin Manufacturing,22-Mar-24,No-justification,No-justification,No,344.5300348484849,39
Trutex,School uniforms (manufactured garments sold via TrutexDirect),"Outwood Grange Academies Trust have been working closely with our uniform provider, Trutex, to minimise the impact of rising manufacturing and import costs over the last few years. Unfortunately. ongoing inflationary pressures in the economy coupled with the disruption in the Red Sea has resulted in significant freight cost increases (as well as extended lead times) meaning that Trutex will be applying a small price increase across their products. We have been informed of a 3% price increase and we are working with Trutex to try to keep this price increase to a minimum as we know that families are currently facing increases in prices across so many bills and purchases.The prices on www.trutexdirect.com will change from 8 February 2024.In the last few years we have worked to reduce the number of logoed items within our uniform in line with the Government's recent guidance.Items that no longer require a branded version e.g. shirts/blouses, PE kit, are still available with the logo on the Trutex website, should you choose to purchase them, but alternative comparable items are acceptable. This list also includes skirts and trousers that can now be purchased from other suppliers without a logo, as long as they meet the requirements set out in your school's Uniform Policy. The uniform policy can be found on school websites. If you have any queries please contact school.Please be assured that as a Trust we regularly run an open procurement process to appoint our uniform supplier to ensure that we secure the lowest price for highest quality garments.I would also bring your attention to Trutex Pre-Loved which offers recycled uniform that has been professionally cleaned and, where necessary, repaired to ensure it is in 'as good as new' condition. This is available at significantly reduced prices and can be viewed by logging in to www.trutex.com with code: LEA00980SC or adding this code to an existing account. Not only does this offer great value for money, but also supports the Trust's environmental and sustainability agenda.",31 – Manufacturing,315210 – Cut and Sew Apparel Contractors),8-Feb-24,Cost,Cost,No,327.34074571428573,332
Venator,Titanium Dioxide,"Venator is committed to developing our position as a reliable, sustainable and high-quality titanium dioxide supplier. Effective 1st January 2022, Venator will increase the selling price of all grades of its titanium dioxide sold in Asia Pacific by US$400 per tonne.Your Venator Sales Manager will be in contact with you to discuss this price increase as well as our full commercial offer to you as our valued customer. We thank you for the continued confidence you place in Venator as a key supplier and for the opportunity to supply your titanium dioxide needs. If you have any questions, please do not hesitate to contact your Venator Sales Manager.",31 – Manufacturing,"325992 – Resin, Synthetic Rubber, and Artificial Synthetic Fibers and Filaments Manufacturing",1-Jan-22,Quality,Quality,No,337.6611054901961,108
AOC,Industrial Resins (Unsaturated Polyester and Vinyl Ester Resins),"AOC has today announced a price increase for its entire product portfolio sold in Europe, Middle East, Africa and India. The increase will be 100 per ton for Unsaturated Polyester-based and 250 per ton for Vinyl Ester-based products and formulations. The price increase will be effective immediately, or as soon as contracts allow.  The rapid escalation of raw material costs and deteriorating raw material availability are adversely impacting AOC's cost of production. In addition, the European announcement of anti-dumping measures for epoxy resins with associated duties on imported materials is causing an immediate cost increase. AOC's global purchasing resources continue to work diligently with their network of supplier partners to manage costs, maintain supply, and meet customer needs. AOC is working hard to minimize the impact of the raw material cost increase, but presently we have no other choice but to raise the prices of our products. ",32 - Manufacturing,325211 – Plastics Material and Resin Manufacturing,"Feburary 7, 2024",Cost,Cost,No,335.34772174825173,147
Avery Dennison,Pressure-Sensitive Labels and Packaging Films,"We are writing to inform you that due to price increases (mainly from tariffs) we have incurred on raw materials, we must impose a 2.5% surcharge on all products, including those on list and special pricing agreements. This surcharge will take effect on Monday May 12, 2025. The surcharge will be denoted on your Purchase Order as, Tariff Surcharge Fee. The actual price of products will not change, therefore there will not be new price lists delivered. The surcharge may be adjusted (up or down) as raw material prices change and we will notify you accordingly.",32 - Manufacturing,"322222 – Coated and Laminated Paper Manufacturing, or 326199 – All Other Plastics Product Manufacturing",12-May-25,Cost,Cost,No,328.75459989247315,96
BASF,Polyurethane Systems (Containing Alkyl Phosphate Esters),"BASF will increase prices for polyurethane systems containing alkyl phosphate esters produced in the United States. This increase will be effective for orders shipping on or after January 1, 2025, or as contracts allow.This price increase is due to increasing market price of raw materials resulting from anti-dumping duties for alkyl phosphate esters from China, effective November 27, 2024. More information on determination of anti-dumping duties for alkyl phosphate esters can be found on the United States International Trade Administration website:",32 - Manufacturing,"325510 – Paint and Coating Manufacturing, or more broadly 325199 – All Other Basic Organic Chemical Manufacturing",1-Jan-25,Cost,Cost,No,339.3445447887324,81
Bostik,"Specialty Industrial Adhesives (Hygiene, Paper, and Cardboard)","With effect on 15th of April 2024, Bostik, a leading global adhesive specialist for industrial, construction and consumer markets, announced today it will increase prices in accordance with its contractual commitments on Hygiene, Paper and Cardboard specialty adhesives (Hot melt, Hot Melt Pressure Sensitive and Water based technologies). Such evolution will be applicable to orders with a requested delivery date of April 15, 2024 or later. This increase is a result of inflation on manufacturing and transportation costs, which have affected the cost of doing business across the adhesive industry. Since last year, the costs & supply of raw materials have been worsening significantly.The chemical industry is facing unforeseen and persisting headwinds on maritime freight (Red Sea attacks, bottlenecking effects on Suez & Panama canals) shortages due to very low production rates, many crackers and plants running under the standard levels, additional taxes set up by China on raw materials made from crude oil derivatives (C5/C9 raffinates). To date, Bostik has done its best to absorb the impact and minimize the disruption to customers. However, despite the company's best efforts, it will be necessary to share the economic burden to ensure business continuity. ",32 - Manufacturing,325520 – Adhesive Manufacturing,15-Apr-24,Cost,Cost,No,347.14397,193
Celanese Corporation,Specialty Chemicals and Engineered Materials,"Celanese Corporation (NYSE: CE), a global specialty materials and chemical company, will increase prices for a range of products and wishes to provide our customers context for our decision and appropriate notice for planning purposes. Given the dynamic conditions of global trade, Celanese is uniquely positioned to actively manage our global and regional operations to support our valued customers around the world with enhanced supply continuity. These price increases are associated with, among others, heightened costs of product movement and inventory repositioning, plant operational expenses, changing trade regulations, and raw materials. The price increases will be effective on June 1, 2025, or as contracts otherwise allow. Additionally, individual grades may be subject to higher increases than specified below.",32 - Manufacturing,325199 – All Other Basic Organic Chemical Manufacturing,1-Jun-25,Cost,Cost,No,332.4818039823009,118
"COIM USA, Inc. (Chemicals)",Aromatic Polyester Polyols (Isoexter Brand),"Dear Valued Customers,Effective on all shipments on or after July 1st, 2024, or as contracts allow, COIM USA, Inc. is increasing the selling prices of its Isoexter aromatic polyester polyols as follows:Isoexter polyester polyols for rigid board applications: $0.06/lb.Isoexter polyester polyols for spray foam and pour in place applications: $0.04/lb.This increase is needed to offset increases in the cost of raw materials.We appreciate the business partnership between our companies, and your account manager will contact you shortly to discuss the specifics of this increase.",32 - Manufacturing,325211 – Plastics Material and Resin Manufacturing,1-Jul-24,Cost,Cost,No,338.89641893333334,84
Defra,Official Government-Issued Labels (Produced on Demand),Unfortunately because of a steep increase in the cost of raw materials and production it has become necessary to increase the price of official labels from 1 November 2011. The increase has been agreed after lengthy negotiations between Fera Procurement and Banner Managed Communication and is the first increase in the price of labels since 2007. A new price list is attached to this letter. You will note that the increase percentage varies across the label range based on usage. To avoid overstocking an increased number of labels will now be available only as 'Produced on Demand' (POD) and the prices for these labels will be provided by Banner at time of order. Please allow sufficient time when ordering labels. The contract requires that labels should be supplied within 10 working days from receipt of order.,32 - Manufacturing,323111 – Commercial Printing or 322299 – All Other Converted Paper Product Manufacturing,1-Nov-11,Cost,Cost,No,320.3564508396946,136
Dulux,"Decorative and Protective Coatings (Paints, Woodcare, Concrete Finishes)","Dear Customer, Dulux Price Increase 1 May 2023. We wish to advise you of a market wide price increase effective 1 May 2023 across our Decorative Paints, Woodcare, Protective Coating, Acratex, Powders and Decorative Concrete (Avista & Emer) products. There will be some variability in the range of price movements by product, based on changes to relevant input costs. The decision around a price increase is not taken lightly, this increase is the direct result of unprecedented increases in associated input costs within our business. This has been driven primarily by upstream global supply chain events that have resulted in both significant supply constraints and more recently fuel levies resulting in increased freight costs. Please be assured that we continue to take every opportunity to minimize cost increases. Our procurement teams are constantly working with suppliers to ensure we are minimizing input cost increases, while upholding the high level of product quality and service that our customers rely on. Your Dulux Representative will be able to provide more detail on the prices and products affected. Our commitment remains to the long term growth of the Paints and Coatings industry in Australia, with our focus on providing you with quality products and services that deliver mutual business success. I would like to take this opportunity to acknowledge your ongoing support and we look forward to continuing our business together. Yours sincerely, ",32 - Manufacturing,325510 – Paint and Coating Manufacturing,1-May-23,Cost,Cost,No,327.57524958904116,230
