Firm,Product/service,Letter,NAICS2,Industry,Date,JustificationType (LLM Label),JustificationType (Authors' Label),Subscription,Concreteness,Length
Adobe,Adobe Creative Cloud Pro Plan,"At Adobe, we're always evolving our products to make them better for our customers, and we've continued to build new features and enhance product workflows and performance. We're also expanding your toolbox to better support your creative process, from ideation through to final delivery. The Creative Cloud plans for subscribers in North America (United States, Canada, and Mexico) are changing to give users the flexibility to select the plan that best fits their needs. At this time, there will be no changes to Creative Cloud plans for customers in all other regions and countries outside of North America. Learn more about the impacts to Creative Cloud plans for customers residing outside of North America. The Creative Cloud All Apps plan will be renamed Creative Cloud Pro for individuals and Creative Cloud Pro for students and teachers. These plans will also include new benefits such as: Unlimited access to standard image and vector generation features including Generative Fill in Photoshop.Additional generative credits for premium video and audio generation features including Image to video, Translate video, and Translate audio in Adobe Firefly and Generative Extend in Premiere Pro. Ability to create multiple boards in Firefly Boards (beta), the new concepting and mood-boarding tool in Adobe Firefly.The choice to use non-Adobe generative AI models directly in Adobe Firefly, like OpenAI GPT image generation, Google Imagen and Veo, and Flux. The additional services and benefits make Creative Cloud Pro our best value offering across Creative Cloud, and the plan's price is increasing to reflect this new value. The Creative Cloud Pro plan for students and teachers will continue to have a significant discount for eligible customers compared to the individual plan, while including the same new benefits. ","54 – Professional, Scientific, and Technical Services",511210 – Software Publishers,17-Jun-25,Quality,Quality,Yes,335.2459158844766,283
Amazon,Amazon Prime (Discounted Monthly Membership),"Thank you for being a valued member of Amazon Prime. We are writing to you about an upcoming change to your membership. As of February 18, 2022, the price of the monthly discounted Prime membership (for EBT and select government assistance recipients) has increased from $5.99 to $6.99. The new prices, plus applicable taxes, will apply after March 25, 2022, on the date of your next renewal.We continue to invest in making Prime even more valuable for members. Since the last price change in 2018, we have added more product selection available with fast, free, unlimited Prime shipping, and we expanded Free Same-Day Delivery from 48 to more than 90 U.S. metropolitan areas. In addition, Prime Video has tripled the number of Amazon Original series and movies; and this September, Prime Video will release the highly anticipated The Lord of the Rings: The Rings of Power and become the exclusive home of NFL's Thursday Night Football. This is all on top of billions of dollars in Prime Day savings over the years; the addition of new program benefits like prescription savings and fast, free delivery from Amazon Pharmacy; and the continued expansion of Amazon Music for Prime members, Prime Reading, and Prime Gaming.","54 – Professional, Scientific, and Technical Services",541512 – Computer Systems Design Services,25-Mar-22,Quality,Quality,Yes,336.1916307253886,203
Amazon,Amazon Prime (Monthly Membership),"As of 15 September 2022, the price of the monthly Prime membership will increase from ¬£7.99 to ¬£8.99, and the price of the annual Prime membership will increase from ¬£79 to ¬£95. The new price will apply to renewals starting 15 September 2022. You can view your next renewal date, manage, or cancel your membership by visiting your account. We continue to focus on making Prime even more valuable for members. This is the first time we have changed the price of Prime in the UK since 2014. During this time, we have significantly increased the number of products available with unlimited, fast Prime delivery; added and expanded ultra-fast fresh grocery delivery; and added more high-quality digital entertainment, including TV, movies, music, games, and books. Prime Video in particular has increased the number of TV series and movies on offer, including Amazon Originals, as well as live sports coverage, such as the Premier League and Autumn Nations Series.","54 – Professional, Scientific, and Technical Services",541512 – Computer Systems Design Services,15-Sep-22,Quality,Quality,Yes,336.14326353333337,158
Amazon,Kindle Unlimited,"We are writing to let you know that the price of a monthly Kindle Unlimited membership increased from $9.99 to $11.99 on May 11, 2023. The new price will apply to you after June 18, 2023, on the date of your next monthly renewal. Since the launch of Kindle Unlimited in 2014, we have grown our eBook catalog from 600,000 titles to over 4 million titles today, introduced digital magazine subscriptions, and improved selection quality across genres. Kindle Unlimited members have unparalleled access to read as much as they want from a rich catalog of eBooks, audiobooks, magazines, and comics. We continue to invest in making Kindle Unlimited even more valuable for members. Until July 31, 2023, you have the option to lock in your current price ($9.99/month) by purchasing upfront 6 or 12 months of Kindle Unlimited. The lock-in price will take effect on the next billing date after the offer is purchased. To continue your membership at the new monthly price of $11.99, no further action is required. To manage or cancel your membership at any time, or to see your next renewal date, visit Your Membership page. ","54 – Professional, Scientific, and Technical Services",541512 – Computer Systems Design Services,18-Jun-23,Quality,Quality,Yes,323.5766655555555,190
Amazon,Amazon Music Unlimited - Individual,"Dear Amazon Customer, We're updating the price of your Amazon Music Unlimited - Individual plan so we can continue to bring you new content and features. Your price will increase from $9.99 to $10.99, plus applicable taxes, per billing cycle. The new price will apply on your first billing date on or after March 5, 2025. If you signed up with a promotional offer, nothing will change for the remainder of your promotional period. Afterwards, we will honor the original subscription price for your first full-price billing cycle. As of the second full-price billing cycle, your price will change from $9.99 to $10.99, plus applicable taxes.Questions? Please see our FAQ page.","54 – Professional, Scientific, and Technical Services",541512 – Computer Systems Design Services,5-Mar-25,Quality,Quality,Yes,335.10834476190473,111
Autodesk,Autodesk Fusion,"Thank you for choosing Fusion for personal use. As a reminder, to qualify for Fusion for personal use, you must use the software for non-commercial projects only and generate less than $1,000 USD in annual revenue.If you no longer qualify for Fusion for personal use, this email provides important operational information about Fusion commercial subscriptions.This year at Autodesk University 2023, we further communicated the Fusion industry cloud vision where we have committed to building a future where you can unify data, technologies, and workflows across your entire organization, move seamlessly between Autodesk products, and extend your reach through 3rd party applications, partnerships, and APIs.As a result, we are rebalancing the price of Autodesk Fusion to represent the value it delivers. Effective January 30, 2024, the annual subscription price will increase to $680 USD SRP.","54 – Professional, Scientific, and Technical Services",541330 – Engineering Services,30-Jan-24,Quality,Quality,Yes,324.74511942622945,134
AwardWallet Plus,AwardWallet Plus,"We are writing to let you know that the price of AwardWallet Plus will be increasing to $49.99 per year on December 18, 2024. We are truly grateful for your support over the years. As one of our very early customers, we've kept your subscription cost at $10 per year‚ even as the price of AwardWallet Plus increased for new subscribers. Unfortunately, we won't be able to offer this discount going forward. This change helps us ensure the security and reliability of the product we all love and allows us to invest in improvements and exciting new features. Rest assured that you won't be paying more for just the same product ‚we think you're going to enjoy what's coming. The new price will take effect automatically when your membership renews on 1/30/25.","54 – Professional, Scientific, and Technical Services",541512 – Computer Systems Design Services,18-Dec-24,Quality,Quality,Yes,305.8014871317829,132
Backblaze,Backblaze Computer Backup,"Over the coming months, Backblaze Computer Backup will see a number of updates and upgrades. I'm writing today to explain the changes, which include updates to our pricing, free access to one of our most popular features, and a suite of upgrades to the service. I'll unpack them for you here:‚ Computer Backup Price Increase: Effective October 3, new purchases and renewals will be $9/month, $99/year, and $189 for two-year subscription plans, and Forever Version History pricing will be $0.006/GB.‚ Free One Year Extended Version History: Also effective October 3, all Computer Backup subscriptions may enable One Year Extended Version History, previously a $2 per month expense, for free. Being able to recover deleted or altered files up to a year later saves Computer Backup users from huge headaches, and now this benefit is available to all subscribers. Starting October 3, log into your account and select One Year of Extended Version History for free.","54 – Professional, Scientific, and Technical Services",541512 – Computer Systems Design Services,3-Oct-23,Quality,Quality,Yes,332.0642815646259,155
Dashlane,Dashlane (Password Manager Subscription),"Your subscription will change from PLN 81.99/year to PLN 294.99/ year on Jun 20, 2024. To continue your subscription at the new price, tap Agree.","54 – Professional, Scientific, and Technical Services",541519 – Other Computer Related Services,20-Jun-24,No-justification,No-justification,Yes,340.36923842105267,25
Dropbox,Dropbox Plus,"Next year, the cost of Dropbox Plus is increasing to ‚Ç¨119.88 per year (plus any applicable taxes). The change will take effect on your first billing date after January 18, 2020. We're thankful you're a customer. That's why we regularly upgrade our plans- because we want you to get great value from Dropbox. Recently, we launched Dropbox Transfer, a quick, secure way to deliver large files. And, our new keyword search can now find keywords directly inside your docs. We've made lots of improvements this year and will continue to add exciting new features to enhance your experience.","54 – Professional, Scientific, and Technical Services",541512 – Computer Systems Design Services,18-Jan-20,Quality,Quality,Yes,316.42287467391304,98
Elementor,Elementor Pro Plans,"We don't want to distract you from making awesome websites, we just want to let you know that we are updating our Pro plans. On March 9th, 2021, we will be adding new Studio and Agency Pro subscription plans and updating the Expert plan, to best accommodate our users' growing needs. These changes will only apply to new purchases. If you're on an existing active subscription plan, nothing changes for you. Since we launched Elementor 4.5 years ago, we have evolved from a modest page builder into a comprehensive website building platform, used by our diverse community to build more than 7 million websites. As we continue to add value to the platform and scale, our new plan structure aims to grow alongside your business, meet your different needs, while upholding the same entry-level affordability.","54 – Professional, Scientific, and Technical Services",541511 – Custom Computer Programming Services,9-Mar-21,Quality,Quality,Yes,326.94285643410853,135
Evernote,Evernote Legacy Plus Plan,"Subscription price change. We're writing to let you know that the price of your legacy Plus plan will increase on your next billing date. You'll receive additional details from Apple since you purchased your Evernote subscription directly through the App Store. This increase, the first in 6 years, helps us continue improving product performance and reliability, as well as enabling further investment in both our core capabilities, like world-class search, templates and web clipper- and new features like Home, Tasks, and Calendar. We're notifying all customers impacted by this change in advance of their renewal date. No action is required on your part, but you can manage your subscription anytime by following these steps. As always, we're committed to providing quality services to you and appreciate your business and continued support. We're here to help if you need it. Visit the Help Center for more information.Sincerely,","54 – Professional, Scientific, and Technical Services",511210 – Software Publishers,1-May-22,Quality,Quality,Yes,330.90339644295307,146
Evernote,Evernote Personal Annual Subscription,"We're writing to let you know about an upcoming change to your Evernote Personal subscription.Also, we're excited to bring you an update on some of the major new features and improvements that are in the pipeline for Evernote. Each one is designed help you enhance your productivity. The team is working hard to bring them to you in the upcoming months-more on this below.First, then pricing. The price of your Annual subscription will change to 129.99 USD per Year. The new price will take effect on your next renewal, 9/4/2023.","54 – Professional, Scientific, and Technical Services",511210 – Software Publishers,4-Sep-23,Quality,Quality,Yes,318.74649363636365,90
Front,Front Starter Plan Subscription,"We're reaching out to let you know about new features in Front, upcoming changes to our pricing plans, and how they will impact your account. We've recently refreshed our plans and will be automatically migrating your subscription to our latest Starter plan at your next renewal. On this plan, you'll have access to all the latest features, including our new integrated Knowledge Base and a revamped rules experience. You'll be able to create up to 10 total rules - including new rule sets that allow you to build dozens of workflows with a single rule. Rest assured your existing rules will continue to run and you'll be able to edit them at any time.Depending on the price you pay today, transitioning you to this new plan might involve a license price increase. If that's the case, we're committed to limiting your license price increase to no more than 15%. Learn more about what's included in the latest Starter plan here.","54 – Professional, Scientific, and Technical Services",541512 – Computer Systems Design Services,1-Feb-24,Quality,Quality,Yes,319.56486,160
Glossybox,Glam box subscription,"Our GLOSSYBOX community is growing fast! The time has come to take GLOSSYBOX Canada to the next level. We want to keep providing you with the unbeatable experience you have come to know and love and those hidden beauty gems that make GLOSSYBOX so exciting. There have been a lot of changes here at GLOSSYBOX Canada and we're thrilled you like them, including: Our GLOSSY new website, a gifting option, better beauty profiles, new videos and contests, exclusive behind-the-scenes content, and of course great brands from around the world! In order to do so, we will be increasing our subscription prices as of October. Now, we will have North America-wide pricing and for only $21 per month, you can continue to receive luxury-sized, fabulous beauty products, featuring the most exciting brands and newest innovations. BUT to show our appreciation for our loyal GLOSSIES, we would like to provide you with an extra month at our current subscription price of $15. While all new subscribers will be paying $21 starting in the month of October, you will not be affected by the price change until November. Taxes are still included in our price, and we will continue to send your GLOSSYBOXES with no additional shipping and handling charges.","54 – Professional, Scientific, and Technical Services",541512 – Computer Systems Design Services,1-Oct-12,"Market, quality","Market, quality",Yes,317.15427766169154,207
Google,Nest Aware Subscription (1st Gen),"Thank you for being a 1st gen Nest Aware customer. We wanted to let you know that the price of your Nest Aware subscription for Riata will soon increase from $110.00 a year to $180.00 a year (plus applicable taxes)'. This new price will go into effect on your next bill that occurs on or after November 6, 2023. Your Nest Aware subscription will continue at the new price, and your current features will remain the same, with video history, advanced motion sensing, the ability to save clips, and more. Learn more about the upcoming price change.","54 – Professional, Scientific, and Technical Services",541513 – Computer Facilities Management Services,6-Nov-23,No-justification,No-justification,Yes,329.2714553846154,97
Google,Google Workspace – Enterprise Standard,"We're writing to let you know that earlier this year we announced pricing changes to Google Workspace products that took effect for new and existing customers starting March 2023. These pricing changes will go into effect for your organization starting February 5, 2024. Your subscription price will be automatically updated with one or more of the following pricing changes starting February 5, 2024: Enterprise Standard subscription global list price has increased. ","54 – Professional, Scientific, and Technical Services",541519 – Other Computer Related Services,5-Feb-24,No-justification,No-justification,Yes,327.1757987692308,71
Google,Google One (100 GB),"Google LLC is increasing the price of your subscription ""Google One (100 GB)"" from ‚Ç±89.00/month to ‚Ç±119.00/month starting on March 28, 2025. You'll automatically be charged the subscription price (plus any taxes) to the payment method provided until you cancel. Your price may change again as described in the Google Play Terms of Service. You can choose to stop your subscription from renewing at any time and see upcoming charges in Subscriptions on Google Play. Learn how to cancel","54 – Professional, Scientific, and Technical Services",541519 – Other Computer Related Services,28-Mar-25,No-justification,No-justification,Yes,332.7320328571429,79
Google,Google Workspace Enterprise Standard,"Starting Feb 16, 2024, the price of your Google Workspace Enterprise Standard subscription will change. List prices are periodically reviewed and updated to reflect the additional value we've delivered within ourproducts.","54 – Professional, Scientific, and Technical Services",541512 – Computer Systems Design Services,16-Feb-24,Quality,Quality,Yes,331.0601492,31
HostGator,Hosting Subscription (HostGator),"Thank you for choosing HostGator for your hosting needs. We appreciate the opportunity to provide you with top-tier website hosting services and the tools to help your business succeed online. We are writing to inform you of an upcoming change to your Hosting subscription. Effective September 20, 2024, the monthly renewal price for Hosting will increase. This increase will be reflected on your monthly invoice following the effective date. ","54 – Professional, Scientific, and Technical Services",541513 – Computer Facilities Management Services,20-Sep-24,No-justification,No-justification,Yes,325.83438328125004,69
Infiniti,INFINITI InTouch Services,"As of October 26, 2023, INFINITI InTouch Services pricing will change as outlined below.*Please note this email does not indicate you are being charged for services. If you are in an included trial or don't have an active INFINITI InTouch Services subscription, the price increase will not affect you unless you purchase a paid subscription. The price change will not affect any payments made before October 26, 2023 and any promotional offers will continue at the current discounted rate and charge at the new price effective with your first renewal on or after October 26, 2023. All payments made on or after October 26, 2023 will be at the new price.","54 – Professional, Scientific, and Technical Services",541513 – Computer Facilities Management Services,26-Oct-23,No-justification,No-justification,Yes,322.03567363636364,111
Intuit,QuickBooks,"Thank you for choosing QuickBooks. We want to inform you of upcoming pricing changes that will impact your account. Beginning on or after 08/14/2024, the following pricing (plus applicable taxes) will take effect. QuickBooks is committed to improving how you manage daily business tasks with an integrated ecosystem of products and services. Over the past year, we've made improvements to help you save time and get more done by automating tasks and streamlining workflows. You can now identify deductions and receive personalized insights that help you make informed business decisions. Price increases enable us to continue to deliver best-in-class tools for you to confidently run your business and grow. Find more information here about recent innovations, plus tools and features that have been added to your version of QuickBooks.","54 – Professional, Scientific, and Technical Services",541213 – Tax Preparation Services,14-Aug-24,Quality,Quality,Yes,319.69716241935487,129
LastPass,LastPass Premium,"For over a decade, we’ve been dedicated to providing you with a powerful solution that makes it easy to manage your passwords and protect your digital life. Starting today, LastPass Premium will be $36 per year for new customers. For existing users, your subscription will renew at the new $36 list price. In addition to our Premium offering, our personal lineup also includes LastPass Families, which provides 6 licenses of LastPass for $48. This allows you to share LastPass with up to 5 other people – a great way to protect your loved ones! With Families, you can store and share passwords for entertainment sites, medical accounts and credit cards, and organize them into folders by family member or type of account so everyone has the access they need. In today’s age of ever-changing security threats, the value of a best-in-class password manager cannot be overstated. LastPass helps all customers create unique, strong passwords for every account, and store them in a secure vault, keeping you safe from 3rd party breaches. Our LastPass security challenge and password generator help you identify weak or reused passwords and create new strong ones. LastPass also helps prevent successful phishing attempts by only filling in your credentials on authentic websites. In addition to standard LastPass features like a secure vault, autofill on sites and in apps, password sharing, and free syncing across devices, LastPass Premium offers exceptional features that are becoming more and more necessary in today’s digital landscape. ","54 – Professional, Scientific, and Technical Services",541519 – Other Computer Related Services,,Quality,Quality,Yes,332.9914445110133,245
LingQ,LingQ Premium,"We just wanted to let you know that the price of LingQ Premium will be going up around 15% on March 4, We don't take these decisions lightly. Our prices haven't changed in over five years, but the organization and ecosystem has. In order to continue providing a valuable service and to continue innovating and making LingQ better, this is necessary. We wanted to let you know in advance, so that if you are thinking of upgrading to Premium, you could lock in the current lower price before it changes. The price for existing Premium subscribers will not change as long as they remain Premium. The new pricing will only affect subscribers to new plans.","54 – Professional, Scientific, and Technical Services",541511 – Custom Computer Programming Services,4-Mar-24,Quality,Quality,Yes,313.34240678571433,115
Liquid Web,Web Hosting Services,"Pricing Update Coming SoonThank you for being a valued customer of Liquid Web. We're writing to inform you of a pricing change that will impact your monthly invoice; however, you have an option to keep your current pricing, outlined below. We understand and appreciate any pricing changes are impactful. As a loyal customer, we are offering you an opportunity to lock in your current monthly pricing through an annual commitment. You will still be billed monthly at your current rate, with no pricing increases during this one year commitment period.Lock My Current PriceShould you choose not to take this option, a 12% increase will be added to your monthly invoice for account number xxxxx starting April 6, 2025.","54 – Professional, Scientific, and Technical Services",541519 – Other Computer Related Services,6-Apr-25,No-justification,No-justification,Yes,335.10115274336283,118
